{
  "schemaVersion": 1,
  "family": "D",
  "familyName": "hooks",
  "generator": "scripts/render-reference.mjs",
  "members": [
    {
      "name": "adopt-orchestrator-prompts",
      "kind": "hook",
      "shipsTo": {
        "tier": "framework",
        "absent": "no-lane"
      },
      "description": "PostToolUse: adopt a new orchestrator-prompt",
      "source": {
        "path": ".claude/hooks/adopt-orchestrator-prompts.sh",
        "line": 2
      },
      "extras": {
        "event": {
          "absent": "unregistered"
        },
        "matcher": {
          "absent": "unregistered"
        },
        "delivery": [
          "@cc-only-rationale"
        ]
      },
      "example": null
    },
    {
      "name": "ask-question-reminder",
      "kind": "hook",
      "shipsTo": {
        "tier": "framework",
        "stacks": [
          "react-native",
          "react-next",
          "react-spa",
          "ts-server"
        ]
      },
      "description": "PreToolUse:AskUserQuestion hook — pre-question fork-challenge nudge (consumer-safe session UX)",
      "source": {
        "path": ".claude/hooks/ask-question-reminder.sh",
        "line": 2
      },
      "extras": {
        "event": [
          "PreToolUse"
        ],
        "matcher": [
          "AskUserQuestion"
        ],
        "delivery": [
          "@dual-pair:hook-lang-i18n (spec: docs/superpowers/specs/2026-06-01-hook-lang-i18n-design.md)",
          "@cc-only-rationale",
          "plugin"
        ]
      },
      "example": null
    },
    {
      "name": "check-doc-authority",
      "kind": "hook",
      "shipsTo": {
        "tier": "framework",
        "absent": "no-lane"
      },
      "description": "PostToolUse gate — principle-09 doc-authority header quick-check (delegates to the 09 bin)",
      "source": {
        "path": ".claude/hooks/check-doc-authority.sh",
        "line": 2
      },
      "extras": {
        "event": [
          "PostToolUse"
        ],
        "matcher": [
          "Edit|Write|MultiEdit"
        ],
        "delivery": [
          "@cc-only-rationale",
          "plugin"
        ]
      },
      "example": null
    },
    {
      "name": "check-doc-authority-header",
      "kind": "hook",
      "shipsTo": {
        "tier": "framework",
        "stacks": [
          "react-native",
          "react-next",
          "react-spa",
          "ts-server"
        ]
      },
      "description": "PostToolUse gate — zero-dep consumer reimplementation of the doc-authority header check",
      "source": {
        "path": ".claude/hooks/check-doc-authority-header.sh",
        "line": 2
      },
      "extras": {
        "event": [
          "PostToolUse"
        ],
        "matcher": [
          "Edit|Write|MultiEdit"
        ],
        "delivery": [
          "@cc-only-rationale",
          "plugin"
        ]
      },
      "example": null
    },
    {
      "name": "check-hook-marker",
      "kind": "hook",
      "shipsTo": {
        "tier": "framework",
        "absent": "no-lane"
      },
      "description": "PostToolUse gate — delivery-channel marker + strict header grammar on touched hook files",
      "source": {
        "path": ".claude/hooks/check-hook-marker.sh",
        "line": 2
      },
      "extras": {
        "event": [
          "PostToolUse"
        ],
        "matcher": [
          "Edit|Write|MultiEdit"
        ],
        "delivery": [
          "@cc-only-rationale",
          "plugin"
        ]
      },
      "example": null
    },
    {
      "name": "check-kickoff-traps",
      "kind": "hook",
      "shipsTo": {
        "tier": "framework",
        "absent": "no-lane"
      },
      "description": "PostToolUse gate — kickoff T-enumeration floor (ai-laziness-traps §3)",
      "source": {
        "path": ".claude/hooks/check-kickoff-traps.sh",
        "line": 2
      },
      "extras": {
        "event": [
          "PostToolUse"
        ],
        "matcher": [
          "Edit|Write|MultiEdit"
        ],
        "delivery": [
          "@cc-only-rationale",
          "plugin"
        ]
      },
      "example": null
    },
    {
      "name": "check-worker-dispatch-channel",
      "kind": "hook",
      "shipsTo": {
        "tier": "framework",
        "absent": "no-lane"
      },
      "description": "PostToolUse gate — edit-time channel for #worker-dispatch-via-subagent",
      "source": {
        "path": ".claude/hooks/check-worker-dispatch-channel.sh",
        "line": 2
      },
      "extras": {
        "event": [
          "PostToolUse"
        ],
        "matcher": [
          "Edit|Write|MultiEdit"
        ],
        "delivery": [
          "@dual-pair:channel-discipline-worker-dispatch",
          "@cc-only-rationale",
          "plugin"
        ]
      },
      "example": null
    },
    {
      "name": "close-aif-task-on-merge",
      "kind": "hook",
      "shipsTo": {
        "tier": "framework",
        "absent": "no-lane"
      },
      "description": "PostToolUse(Bash) hook — close the aif task a merged harvest PR names",
      "source": {
        "path": ".claude/hooks/close-aif-task-on-merge.sh",
        "line": 2
      },
      "extras": {
        "event": [
          "PostToolUse"
        ],
        "matcher": [
          "Bash"
        ],
        "delivery": [
          "@cc-only-rationale"
        ]
      },
      "example": null
    },
    {
      "name": "deps-hash-check",
      "kind": "hook",
      "shipsTo": {
        "tier": "framework",
        "stacks": [
          "python",
          "react-native",
          "react-next",
          "react-spa",
          "ts-server"
        ]
      },
      "description": "UserPromptSubmit hook — per-stack declared-deps staleness detector (package.json/pyproject.toml/Cargo.toml)",
      "source": {
        "path": ".claude/hooks/deps-hash-check.sh",
        "line": 2
      },
      "extras": {
        "event": [
          "UserPromptSubmit"
        ],
        "matcher": [],
        "delivery": [
          "@dual-pair:deps-hash-check-dogfood",
          "plugin"
        ]
      },
      "example": null
    },
    {
      "name": "end-of-turn-reminder",
      "kind": "hook",
      "shipsTo": {
        "tier": "framework",
        "stacks": [
          "react-native",
          "react-next",
          "react-spa",
          "ts-server"
        ]
      },
      "description": "Stop hook — end-of-turn recap + goal-drift verdict reminder",
      "source": {
        "path": ".claude/hooks/end-of-turn-reminder.sh",
        "line": 2
      },
      "extras": {
        "event": [
          "Stop"
        ],
        "matcher": [],
        "delivery": [
          "@dual-pair:hook-lang-i18n (spec: docs/superpowers/specs/2026-06-01-hook-lang-i18n-design.md)",
          "@cc-only-rationale",
          "plugin"
        ]
      },
      "example": null
    },
    {
      "name": "glossary-inject",
      "kind": "hook",
      "shipsTo": {
        "tier": "framework",
        "absent": "no-lane"
      },
      "description": "UserPromptSubmit hook: glossary injection + usage counter (plain-words-recap-v2 D-F).",
      "source": {
        "path": ".claude/hooks/glossary-inject.sh",
        "line": 2
      },
      "extras": {
        "event": {
          "absent": "unregistered"
        },
        "matcher": {
          "absent": "unregistered"
        },
        "delivery": [
          "@cc-only-rationale",
          "plugin"
        ]
      },
      "example": null
    },
    {
      "name": "inject-handoff-on-compact",
      "kind": "hook",
      "shipsTo": {
        "tier": "framework",
        "absent": "no-lane"
      },
      "description": "SessionStart:compact hook — re-injects the model-authored handoff after compaction",
      "source": {
        "path": ".claude/hooks/inject-handoff-on-compact.sh",
        "line": 2
      },
      "extras": {
        "event": [
          "SessionStart"
        ],
        "matcher": [
          "compact"
        ],
        "delivery": [
          "@cc-only-rationale"
        ]
      },
      "example": null
    },
    {
      "name": "inject-matching-rule",
      "kind": "hook",
      "shipsTo": {
        "tier": "framework",
        "stacks": [
          "python",
          "react-native",
          "react-next",
          "react-spa",
          "ts-server"
        ]
      },
      "description": "card loader hook — injects the rule and card summaries that match an edit, a read or a Bash command",
      "source": {
        "path": ".claude/hooks/inject-matching-rule.sh",
        "line": 2
      },
      "extras": {
        "event": [
          "PostToolUse",
          "PreToolUse",
          "SessionStart"
        ],
        "matcher": [
          "Bash",
          "Edit|Write|MultiEdit|Read",
          "compact"
        ],
        "delivery": [
          "@dual-pair:rule-path-scoping",
          "plugin"
        ]
      },
      "example": null
    },
    {
      "name": "inject-memory-codification",
      "kind": "hook",
      "shipsTo": {
        "tier": "framework",
        "stacks": [
          "react-native",
          "react-next",
          "react-spa",
          "ts-server"
        ]
      },
      "description": "PostToolUse hook — path-scoped codify-then-pointer discipline reminder",
      "source": {
        "path": ".claude/hooks/inject-memory-codification.sh",
        "line": 2
      },
      "extras": {
        "event": [
          "PostToolUse"
        ],
        "matcher": [
          "Write"
        ],
        "delivery": [
          "@dual-pair:memory-codification-writemoment",
          "plugin"
        ]
      },
      "example": null
    },
    {
      "name": "inject-output-language",
      "kind": "hook",
      "shipsTo": {
        "tier": "framework",
        "stacks": [
          "react-native",
          "react-next",
          "react-spa",
          "ts-server"
        ]
      },